{
  "$schema": "http://json-schema.org/draft-07/schema#",
  "title": "Prompt Blueprint",
  "type": "object",
  "required": ["blueprint_id", "description", "summary", "template"],
  "additionalProperties": false,
  "properties": {
    "$schema": {
      "type": "string"
    },
    "blueprint_id": {
      "type": "string",
      "pattern": "^[a-z0-9_\\-]+$"
    },
    "description": {
      "type": "string",
      "minLength": 1
    },
    "agent": {
      "type": "string",
      "enum": ["codex", "claude", "generic"]
    },
    "summary": {
      "type": "object",
      "required": ["file", "purpose"],
      "additionalProperties": false,
      "properties": {
        "file": {
          "type": "string",
          "minLength": 1
        },
        "purpose": {
          "type": "string",
          "minLength": 1
        }
      }
    },
    "placeholders": {
      "type": "array",
      "items": {
        "type": "object",
        "required": ["name", "description"],
        "additionalProperties": false,
        "properties": {
          "name": {
            "type": "string",
            "pattern": "^[a-z0-9_\\-]+$"
          },
          "description": {
            "type": "string",
            "minLength": 1
          },
          "example": {
            "type": "string"
          },
          "required": {
            "type": "boolean",
            "default": true
          },
          "default": {
            "type": "string"
          }
        }
      }
    },
    "template": {
      "type": "object",
      "required": ["id", "description", "body", "summary"],
      "additionalProperties": false,
      "properties": {
        "id": {
          "type": "string",
          "minLength": 1
        },
        "description": {
          "type": "string",
          "minLength": 1
        },
        "body": {
          "type": "string",
          "minLength": 1
        },
        "tags": {
          "type": "array",
          "items": {
            "type": "string",
            "minLength": 1
          }
        },
        "summary": {
          "type": "object",
          "required": ["file", "purpose"],
          "additionalProperties": false,
          "properties": {
            "file": {
              "type": "string",
              "minLength": 1
            },
            "purpose": {
              "type": "string",
              "minLength": 1
            }
          }
        }
      }
    }
  }
}
